,title,nickname,data,content
18,"구디단맛집, 구로디지털단지역맛집 오봉집 구로디지털단지점 ","마인트
(aaa9a)",2021. 10. 25. 15:28," 지난 제주도 여행 이후로 오랜만에 만나게 된 시리기리 커플
구로디지털단지가 주말에는 상관이 다소 활발하지 않다고 생각했는데, 
구로디지털단지역 맛집 오봉집을 방문한 뒤로 고정관념이 싹 사라졌다!
회사로 빽빽이 이루어진 공간이라 평일 이외에는
 사람들이 많이 없을 거라고 예상했지만 역시 알려진 맛집은 다르다, 
이른 저녁 시간이었음에도 불구하고 다수의 좌석들이 
다 채워져 있는 것을 보고 '아 여기 찐으로 맛집이다'라고 생각됨 :)     아니 우리네 할머니들이 밭일하고 나서
 새참 먹을 때 쓰는, 아주 친근한 밥상에 8첩 반상이 
순차적으로 놓여 있어 웃음이 절로 나왔다. 
 이 밥상을 받아보자마자 뭔가 오늘 열심히 일했어야만 
했을 것 같은 그런 느낌...! 살짝 죄책감마저 불러일으키는 밥상이었다.
나는 하루 종일 은시리의 집에서 누워있기 바빴는데 말이야 오봉집에서 가장 인기 있는 메뉴인 오봉 스페셜 한상차림!
 직화 낙지와 보쌈 그리고 막국수와 같이 나오는 오봉 스페셜인데
기준은 2인이라고 하지만, 일단 4인이 같이 먹어도 될 정도로 
충분히 넉넉한 양이었다.  밥상에 보쌈 하나만 미리 차려졌는데도
 테이블이 꽉 찰 정도로 풍성했던 오봉집 오봉 스페셜.   알쓰인 우리 이뇽이는 주말 내내 맥주와 함께 했다 
이날도 어김없이 맥주를 먹은 불타는 고구마 
사실 다들 차를 가지고 있어서 오랜만에 만나서 모여도
같이 술을 먹기가 매우 어려운데 이날은 운이 좋게도 
뚜벅이로 놀러 온 통에 오봉집에서 맥주를 한 잔을 함께 할 수 있었다.
오봉집 오봉 스페셜 메뉴들이 기가 막히게 다 알코올을 떠올리게 하는 음식들!  이뇽이와 기리가 맥주를 먹는데 정신이 없는 사이 
나는 내가 제일 좋아하는 메뉴 중 하나인 직화 낙지를 공략했다.
오봉집에 온 다른 손님들의 테이블들을 살펴보면 
 다들 빠짐없이 집 오봉 집 직화 낙지를 시켰던데!
 그만큼 오봉집에서 가장 맛있는 메뉴라는 걸 
반증하는 게 아닐까 싶음 ㅎㅅㅎ  반찬으로 나온 콩나물이 가득 넣고 오봉집 직화낙지 소스가
밥에 잘 버무려지도록 숟가락으로 열심히 섞었다.
직원분께서 비벼 편하게 양푼 같은 큰 그릇을 주셔서
 엄청 역동적으로 골고루 잘 비빌 수 있었던!
 직화 낙지 사이사이에 들어있는 양배추에도 양념이 잘 베어 있어서 
매콤한 양념과 아삭한 식감의 조화가 잘 어우러졌다. 알싸하게 매운맛을 선호하는 나는 직화 낙지 비빔밥에 
청양고추까지 제대로 얹어 먹었는데!!
매워서 쓰읍쓰읍 소리를 내게 되면서도 결국 
끝까지 다 먹어버리게 되는, 매콤한 소스와 불향이 코를 
엄청 자극하는 그런 중독성 강한 맛! 기리씨가 일회용 장갑을 야무지게 끼고 아빠 손맛처럼
김과 각종 고명들을 제대로 버무려냈다 :)
 색감이 빨개서 매콤해 보이지만 오히려
매콤한 맛보다는 새콤달콤한 맛이 강했던 막국수.
직화 낙지를 한입 먹고 매운맛을 중화시키기 위해 곁들여 먹으면 
딱인 사이드 메뉴였다, 막국수에다가 보쌈을 얹어서 먹어도 맛있고! 뜨끈뜨끈한 보쌈에 김장 김치 조합!
 무생채 가득한 김치를 보쌈에 얹어서 
한꺼번에 쌈 싸 먹으면 그야말로 파티지 메뉴가 매우 다채롭고 쌈 채소도 많아 다 같이 싸먹는 
  재미가 있었던 '구로디지털단지맛집 오봉집'  다양한 반찬을 맛집 무한리필처럼 셀프바에서
 갔다 먹을 수도 있고, 저렴한 가격으로 평소 먹지 못했던 
메인 음식들을 한꺼번에 즐길 수 있어서
구로디지털단지에서 데이트를 하거나 구디단 직장인
 점심 메뉴로 함께하면 좋을 맛집이었다 :)  "
19,만족했던 구로디지털단지역 맛집 공유,윈썸에이미,2021. 9. 8. 17:00,"얼마 전 가족들이랑 외식을 하기 위해 
sns에서 핫한 구로디지털단지역 맛집을 다녀왔어요
퀄리티 높은 초밥은 가격 이상의 가치가
있었던지라 감동받았던 곳입니다 이번에 가게되었던 상무초밥은
깔깔거리 내에 위치해있어서
도보로 1분거리였는데요 건물 내에 주차장도 구비되어 있으니
자가용 가져가실 분들은 참고 부탁드려요
또 구로디지털단지역 맛집의 영업시간은
오픈 오전 11시 마감 오후 11시
라스트오더는 10시라 여유로웠어요. 실내로 입장해보니까 거의 카페를 방불케하는
고급스러운 인테리어가 펼쳐졌어요
친구, 연인, 가족 그 누구랑 가도 괜찮을 것 같아서
제 마음에도 쏙 들었는데요. 여기저기 구경하다가 주인장의 칼솜씨도 엿볼 수 있었어요
생선살 똑같은 크기로 슥슥 잘라내는걸보니
절로 박수 갈채가 나왔어요! 한쪽에는 아기의자도 비치되어 있어서
예쓰키즈존임을 알아챘어요.
가족 단위 손님들도 환영하는 분위기라서
더 훈훈하더라고요 ㅎㅎ 시원하게 갈증을 풀어줄 밥이 맛있는
식혜도 팔고 있었는데요 ㅎㅎㅎ
공산품처럼 너무 달지 않으니
어린 아리들부터 어른들까지
다 좋아할 것 같았죠! 테이블 위에 놓여있는 반찬도 살펴봤답니다.
초생강, 단무지, 락교까지 다 초밥이랑
잘 어울릴 것 같아서 고개를 끄덕거렸어요 그 옆에는 노란색 장미꽃이 꽃혀있었는데요
자리마다 예쁜 꽃으로 꾸며놔서 
연인들의 데이트장소로도 손색 없었네요 안내받은 자리에 착석한 뒤 메뉴판을 살펴봤어요
이때 구로디지털단지역 맛집의 대표메뉴로는 모듬 스시를
팔고 있어서 주문해봤어요 약 15분 정도 지나자 정성껏 만든 초밥이 등장했는데요
참고로 따끈한 장국이나 시원한 메밀국수도 나와서
보기만해도 배가 부르더라고요 ㅎㅎ 우선 밑반찬으로 토마토 절임, 양파절임을 먹어봤어요
씹는 순간 새콤달콤한 즙이 새어나와서 온몸의
피곤함이 싹 가시는 것 같았죠 비슷한류로는 묵은지가 나왔는데요.
고춧가루 없이 깨끗하게 씻어나와서
새콤한 맛만 강렬하더라고요 김이 모락모락 퍼지는 장국도 준비되었답니다
초밥을 먹느라 목이 막힐 때
따끈한 국물이 뚫어주니 손이 자주 갔어요! 옆에 있는 메밀소바도 폭풍 젓가락질을 했는데요
은근하게 도는 메밀향도 고급스러워서
절로 쌍따봉을 날리게 되더라고요 구로디지털단지역 맛집에서는
후토마키도 한줄 썰어나왔어요.
특별한 플레이팅부터 공들인 티가 나서
눈을 뗄 수가 없었는데요 그 다음으로는 모듬 스시도 등장했답니다
연어, 새우, 참치 등등 무난하게 맛있는 것들
위주로 나와서 침샘이 폭팔했어요. 바로 간장새우 초밥을 들어서
소스에 찍먹했는데요~!
추가로 간을 더해도 자극적이지 않으니
입으로 거침없이 들어가더라고요! 이번에는 뭘 먹을까 행복한 고민에 빠졌어요
거의 열 피쓰 넘게 나왔지만 거의 겹치는게 없어서
더 대단하다는 생각이 들었어요! 빨간 점을 찍은 오징어 초밥도 집어봤어요!
꽤 도톰하게 잘라나왔지만 
질기지 않아서 칭찬만 연발했어요 ㅎㅎ 기력도 충전할 겸 장어초밥을 맛보았는데요
구로디지털단지 맛집에서는 냄새 제거도 깔끔하게 해주시니
꿀떡꿀떡 넘어갔어요 환절기에 어울리는 따끈한 우동도 먹고 왔답니다
면발은 물론 어묵, 야채, 유부까지 알차게 들어있어서
두 눈이 번쩍 뜨였는데요~~ 젓가락으로 살짝 들어올리자
뽀얀 우동면이 튀어나왔어요 ㅎㅎ
너무 짜지도 싱겁지도 않게 간이 잘 맞아서
국물까지 모두 마셨어요 ~ 구로디지털단지 맛집에서는 사시미까지 욕심냈어요
참치, 전복, 연어,ㅅ ㅐ우 등 거의 고급 해산물만 골라나와서
비주얼부터 남달랐답니다 ㅎㅎ 그 중에서도 귀한 연어회부터 시식했습니다
꼭꼭 씹지 않아도 생크림처럼 부드럽게 녹아내리니
젓가락이 쉴 틈 없이 움직였어요~ 주문벨을 누르자 매실 수정과도 서브되었는데요
한 입 마시자마자 쌉싸래한 향이 비린내를 제거해줘서
이보다 더 좋을 수 없었답니다! 구로디지털단지역 맛집에서는 음식 하나하나
정성이 깃들어 있습니다
제 예민한 미각으로도 확인했던 부분이랍니다
다음번에도 꼭 재방문해야겠어요! 주소: 서울 구로구 새말로 17 2층
영업시간: 평일 16:30~00:00
전화번호: 0507-1392-9291
친구가 족발이 끝내주는 곳이 있다고 해서
찾아간 송이족발인데요
질 좋은 고기를 이용하여 만들어주기 때문에
엄청 부드럽고 집에서도 배달시켜 먹을 정도로
자주 이용하고 있답니다! 주소: 서울 구로구 디지털로32나길 15
영업시간: 매일 14:00~02:00 월화수목일
전화번호: 02-851-3060
퀄리티 좋은 양꼬치를 판매하는
경성양꼬치 가게에도 찾아가게 되었어요!
여기는 고급진 어린양을 이용하여 판매했기 때문에
야들야들한게 부드러움이 매력적이었어요~~!! 주소: 서울 구로구 디지털로32나길 16 춘자빌딩
영업시간: 매일 13:00~01:00 일요일 휴무(비오면 오픈)
전화번호: 010-8824-5627
술 한잔씩 하고 싶을때 맷돌빈대떡 식당을 찾게됩니다
종류별로 다양하게 먹을 수 있었던 모듬전은 특히나
인기가 많았고 여기에 막걸리 한 잔 딱 하면 완벽합니다! 주소: 서울 구로구 디지털로32길 97-33 1층
영업시간: 평일 11:00~03:00
전화번호: 02-864-3113
끝으로 소개드릴 사조참치는 고퀄리티의
참치를 맛볼 수 있는 곳이에요
쫀득하면서 어찌나 싱싱한지 대박이더라구요
덕분에 친구들과 모임을 가질 때 자주 가는 곳이에요~!"
20,이색적인 구로디지털단지역 맛집 소개,"귀촉안
(mephisto69)",2021. 8. 22. 7:00,"지난 토요일, 친한 친구들과 분위기를 내기 위해 소문난 구로디지털단지역 맛집에 다녀왔어요. 유럽을 연상케하는 공간속에서 수준 높은 양식 요리들을 맛깔나게 즐겼던 곳이라 자신있게 소개할게요! 이날 방문했던 식당은 구로디지털단지역 2번 출구에서 걸어서 4분 거리에 위치해 있었어요. 멋스러운 외관에 휘황찬란한 조명이 빼곡히 부착되어 있어, 초행길임에도 멀리서부터 눈에 확 띄더라고요. 유럽을 떠오르게 하는 홀은 감각적이고 엔티크한 느낌이었어요. 우드톤 계열 테이블에 천장 층고가 높아 답답함 없이 편안하게 시간을 보낼 수 있었죠. 원하는 경우 음악도 요청 할 수 있는 구로디지털단지역 맛집인데요. 직원들의 서비스 마인드도 마음에 들었던 곳이라 기분 좋게 여유를 보낼 수 있었어요.  내부 한쪽으로 세련된 형태로 와인잔도 비치되어 있었는데요. 안이 휜히 보일 정도로 깨끗해서, 위생에 민감한 저도 만족스런 미소가 나와더군요.  쭉 구경한 뒤, 안내 받은 테이블로 발걸음을 옮겨보았어요. 의자가 특히 인상적이었는데, 옛스러움과 멋스러움이 공존하는 느낌이라 인증샷을 한컷 촬영해보았습니다. 구로디지털단지역 맛집 메뉴판은 독특한 디자인으로 꾸며져 있었어요. 표지부터 천천히 살펴보던 중, 옆에계신 직원분 추천에 따라 여러 요리들을 주문해보기로 했어요. 가장 먼저 맛본 까망베르치즈는 이쁜 형태로 담겨져 나왔어요. 나오는 순간 눈이 휘둥그레졌고, 양도 기대 이상으로 푸짐하게 나와주어 구로디지털단지역 맛집 사장님의 후한 인심을 인지 할 수 있었어요. 앙!하고 한입 베어무니 사~르르 녹아내리는 부드러움에 담백고소함이 혀에 맴돌아 기분 좋은 미소가 저절로 터져나왔어요. 이윽고 개인적으로 최애 메뉴였던 로마피자, 루꼴라 체리 토마토에요 상큼한 토마토와 루꼴라, 고소한 샤워크림소스가 발라져 나와 피자매니아인 저로써는 제대로 취향저격이더군요. 사각형 모양 피자로 도우가 두꺼운 것이 특징인데, 겉은 바삭하고 속은 촉촉해서 거부감 없이 순식간에 반이나 먹어치웠어요. 여사친이 좋아했던 감바스 비쥬얼이에요. 살이 통통한 새우에 바게트 빵과 올리브향이 솔솔 풍겨서 먹기도 전부터 군침을 꼴까닥 삼키고 말았어요. 해산물 특유의 비린내가 전혀 없었고, 고소한 올리브향에 파슬리 가루의 향긋한 풍미가 더해져 개인적으로 십점만점을 주고싶었어요. 그래도, 하이라이트는 단연 이베리코흑돼지가 아닐까 싶어요. 멋진 플레이팅으로 나와주었는데, 짙은 육향이 테이블 위에 서서히 퍼져 눈이 번쩍 떠지고 말았습니다. 한입 크기로 커팅 후 알싸한 와사비와 곁들여 입에 직행시켰어요. 팡!하고 터지는 육즙에 톡쏘는 풍미가 입에 촤~악 퍼져 포크질을 멈추기가 힘들었어요. 제가 생각하는 꿀팁을 하나 말씀드리자면, 홀그레인머스터드와 곁들여 먹는 방법인데요. 기름진 맛은 덜해지고 새콤달콤함이 가미되어 베스트 조합 중 하나에요. 탱글한 버섯과도 곁들여 먹방을 이어나갔어요. 고기 본연의 맛 그대로 즐겨도 좋지만 소스와 곁들임 재료와 함께해도 더할 나위가 없더군요. 두툼한 빵이 올라간 파스타를 다음 순서로 즐겨보았어요. 세로길이 30cm 접시 위에 수북히 담겨져 나왔는데, 비쥬얼도 예술이라 어깨춤이 절로 터져나왔어요. 면발을 돌돌 말아 후~루룩 면치기를 해보았는데, 적당한 익힘 정도로 조리되어 뚝~뚝 끊김 없이 탱탱한 치감을 경험 할 수 있었죠. 이윽고 구로디지털단지역 맛집 차돌박이해장파스타에 시선을 집중시켰어요. 고소한 풍미가 매력적인 차돌박이가 듬뿍 담겨져 있었고, 매콤함이 짙게 베어져 있어 식욕을 다시금 북돋아주더군요. 지글지글 소리와 황홀한 풍미에 이끌려 바로 먹방을 시작했어요. 따뜻한 온도감이 쭉 이어지게 세팅해주셔서 감사한 마음이 들었던 구로디지털단지역 맛집이에요. 쫄깃한 식감에 차돌은 면과 황금 밸런스를 자랑했어요. 면과 육류는 만나야 한다고 생각하는데, 그말이 쉽게 이해되는 조합이 아닐까 싶습니다. 포만감이 극에 달했지만, 국물 요리가 땡겨 제철조개술찜을 추가했어요. 인위적이지 않은 감칠 내음이 풍겼고, 시원함과 매콤함이 동시에 맞물려 해장이나 술 안주로도 안성맞춤인 메뉴였어요. 색 다른 분위기를 느낄 수 있고, 수준 높은 요리들을 즐겼던 구로디지털단지역 맛집, 개인적으로 100% 만족했던 곳이라 여러분도 한 번 방문해보셔도 좋을 것 같네요. 깔깔거리 근처에 위치한 데이즈앤데이즈는 생방송투데이 2347회에 소개된 빵집이에요. 140여가지 종류 빵을 판매하고 있어 호불호 없이 고를 수 있다는게 장점이고, 매일 직접 로스팅하여 만든 커피는 인위적이지 않은 담백고소한 풍미를 느낄 수 있어 빵과 곁들여 먹기 제격이에요. 신대방역 3번 출구 도보 6분 거리에 위치한 등나무집은 식신로드3 4회에 소개된 탕반집이에요. 대표메뉴 꼬리찜은 잡내 없이 야들거리는 살결은 물론 인위적이지 않은 깊고 진한 국물까지 맛볼 수 있어 귀빈이나 부모님께 대접하기 안성맞춤이에요. 문성 어린이공원에서 도보 4분 거리에 위치한 한우마당 구로점은 생방송투데이 1370회에 소개된 고기집이에요. 1++등급 생등심이 대표메뉴인데, 짙은 육향과 팡!하고 터지는 육즙을 느낄 수 있고, 그윽한 불향까지 머금고 있어 육식파라면 한 번 드셔보시길 추천드리고 싶어요. 구로디지털단지역 2번 출구에서 도보 7분 거리에 위치한 홍주식당은 우동과 카츠가 유명한 음식점이에요. 우동의 경우 자가제면으로 뽑아내어 탄력감 깃든 식감을 느낄 수 있고, 국물의 경우 비법 재료와 소스가 첨가되어 장시간 끓여낸 형태라 깊고 진한 풍미를 경험 할 수 있어요. 
위 포스팅은,
소정의 원고료를 받고 작성했습니다."
21,색달랐던 구로디지털단지역 맛집,"블랙빈
(youjin0113)",2021. 6. 23. 13:50,"최근에 친구들과 모임을 위해 구로디지털단지역 맛집으로 다녀오게 되었어요.
잡내 하나 안나는 진짜 곱창을 먹을 수 있는 곳이라 잊혀지지 않는 곳이에요.  주소 : 서울 구로구 디지털로32나길 16 1층
전화번호 : 02-868-0123
영업시간 : 매일 16:00 - 22:00 이날 갔던 옛날황소곱창은 구로디지털단지역 2번출구에서 걸어서 5분 안에 도착하더라구요.
건물 바로 앞에는 흰색 큰 풍선이 달려있어 저멀리에서도 쉽게 눈에 띄었답니다. 특히나 들어가는 입구에는 2인분 주문하면 1인분을 더 준다고 하니 사장님의 인심까지 파악할 수 있었죠. 안으로 들어가자 쾌적한 내부가 저희를 반겨줬거든요.
이미 사람들이 한껏 채워져 있는 모습에 유명세를 타고 있는구나 싶어 기대되었답니다. 벽면으로는 포장이 된다는 말이 적혀있더라구요.
덕분에 다음에 집에서 먹고 싶을 때 들고가면 좋을 것 같았어요. 얼른 메뉴판을 보고 주문을 하게 되었어요.
그중에서도 구로디지털단지역 맛집의 모듬곱창과 깍두기볶음밥 까지 선택을 하게 되었답니다. 얼마 지나지않아 금방 기본반찬들이 차려지게 되었어요.
김치부터 샐러드, 절임류 등 다양하게 나와 구성이 알차다 싶더라구요. 뿐만 아니라 식빵도 같이 나와 이건 어디에 먹는건가 싶었는데요.
여쭤보니 기름제거용이라고 하여 신기했답니다. 특히나 참기름장과 찍어 먹을 수 있는 소스도 만나볼 수 있었거든요.
1인당 하나씩 내어주셔서 위생에도 도움이 많이 되었어요. 제일 먼저 백김치 부터 먹어보게 되었거든요.
새콤달콤한게 입갓미으로도 딱 좋을 것 같아 자주 접해줬죠. 구로디지털단지역 맛집에서는 특이했던 대파 김치도 있어서 함께 해봤어요.
씹을수록 새콤한게 잘 익어 곱창과 먹었을 때 그 매력이 훨씬 커질 것 같더라구요. 거기에 생간도 서비스로 나와 같이 먹어볼 수 있었어요.
윤기가 얼마나 대단한지 반짝반짝한 모습들도 볼 수 있었구요. 얼른 젓가락으로 한점 집어다가 참기름장에 찍어봤어요.
쫄깃하면서도 고소함이 더해져 역시나 손질을 잘해주시는구나 알 수 있었죠. 그런가 하면 천엽도 함께 내어주셔서 같이 먹게 되었어요.
처음 보는 비주얼이라 깜짝 놀랐는데, 잡내가 하나도 안나 한입에 넣어봤어요. 참기름장에 찍어서 한입에 투척해봤어요.
쫄깃하면서도 표면이 도돌도돌한게 식감이 부드럽더라구요. 옆에는 뚝배기에 가득 담겨져서 나온 국도 함께 할 수 있었어요.
덕분에 구로디지털단지역 맛집에서는 처음부터 끝까지 따스하게 즐길 수 있었구요. 냉큼 숟가락으로 안에 있는 시레기를 함께 떠서 먹게 되었어요.
몰캉한게 씹는 식감이 재미져 열심히 퍼먹어줬죠. 본격적으로 모듬곱창을 즐겨보기로 했어요.
거의 큰 불판 위를 가득 채울 정도로 얼마나 양이 상당했는지 몰라요. 또한 처음부터 100프로 다 조리가 되어 나오기 때문에 더 기다릴 필요도 없어서 굉장히 편했어요.
노릇노릇하게 구워진 모습을 보자 군침이 절로 돌기 시작했어요. 게다가 구로디지털단지역 맛집에서는 종류별로 양도 푸짐하게 나와 이게 과연 3인분이 맞나 의심이 될 정도더라구요. 얼른 하나 집어다가 입안에 쏙 넣어봤어요.
쫄깃하면서 잡내 하나 나지 않아 씹는 식감이 재미졌어요. 다른 부위들도 다양하게 있어서 열심히 먹어주게 되었답니다.
어떤 것을 먹어도 쫄깃한게 식감이 무척 재미지더라구요. 사장님께서 직접 만들어주신 소스에 찍어 먹어도 끝내주더라구요. 함께 구워주신 떡사리도 함께 해봤어요.
겉은 바삭하고 속은 쫀득한게 먹는 즐거움이 쏠쏠했답니다. 슬라이스로 잘라주신 감자도 있어 같이 먹어봤어요.
바싹 익혀져서 부드러움이 느껴져 고퀄리티를 자랑했어요. 구로디지털단지역 맛집에서는 어떤 것을 먹냐에 따라 식감과 맛이 조금씩 다 다르니 골라 먹는 즐거움이 색달랐답니다. 마지막으로 깍두기 볶음밥 까지 먹기로 했어요.
주변으로는 계란까지 듬뿍 뿌려주셔서 곁들여서 먹기 좋겠더라구요. 계란과 김가루, 볶음밥까지 다 볶아서 한입 크게 먹어봤어요.
3천원이라는 퀄리티가 무색하게 그 이상의 맛을 내주더라구요. 여기에 대파김치까지 얹어 먹으면 화룡점정 이었답니다.
그정도로 사장님의 손맛이 끝내주는 것을 알 수 있었죠. 저희는 맥주까지 주문하여 입가심도 하면서 먹게 되었어요.
구로디지털단지역 맛집에서 먹었던 음식들은 깔끔하여 다음에 또 먹으러 오려고요.   주소 : 서울특별시 구로구 디지털로32나길 19
전화번호 : 0507-1433-1106안내
영업시간 : 매일 15:00~22:00 집에서 보쌈주는족발집으로 자주 주문해서 먹거든요.
질 좋은 고기를 이용하여 만들어주기 때문에 부드러운게 다음날에 먹어도 식감이 똑같아서 자주 애용하고 있어요.  주소 : 서울 구로구 디지털로32나길 15
전화번호 : 02-851-3060
영업시간 : 매일 14:00 - 02:00 월,화,수,목,일요일
매일 15:00 - 03:00 금,토요일 잡내 하나 안나는 양꼬치를 판매하는 경성양꼬치 가게로 다녀오게 되었는데요.
여기는 고급진 어린양을 이용하여 판매했기 때문에 야들야들한게 부드러움이 컸답니다.  주소 : 서울 구로구 디지털로32나길 16 춘자빌딩
전화번호 : 010-8824-5627
영업시간 : 매일 13:00 - 01:00 일요일 휴무(비오면오픈)
토요일 14:00 - 01:00 술한잔씩 하고 싶을 때 맷돌빈대떡으로 향하게 된답니다.
종류별로 다양하게 먹을 수 있었던 모듬전은 특히나 인기가 많았고 여기에 막걸리 한잔 딱 하게 되면 완벽했어요.  주소 : 서울 구로구 디지털로32길 97-33 1층
전화번호 : 02-864-3113
영업시간 : 평일 11:00 - 03:00
주말 11:00 - 02:00  끝으로 소개드릴 사조참치는 고퀄리티의 참치를 맛볼 수 있는 곳이에요.
쫀득하면서 어찌나 싱싱한지 대박이더라구요.
덕분에 친구들과 모임을 가질 때 자주 가는 곳이에요. 
본 포스팅은 업체로부터 경제적 대가를 받고 작성한 글임을 알려드립니다 :)
메뉴구성과 인테리어, 가격, 위치 등을 참고하는 용으로 활용하세요."
