,title,nickname,data,content
0,으뜸이던 구로디지털단지역 맛집,쿨쿨,2021. 11. 10. 12:50,"며칠 전 부모님 결혼기념일을 맞이하여 가족들과 외식을 해볼 겸 구로디지털단지역 맛집에 다녀왔어요.
신선도 높은 참치에 다양한 스끼다시까지 모두가 대만족했던 곳이라 소개할게요.
1. 황제참치
*주소 : 서울특별시 구로구 디지털로 32나길 12
*영업시간 : 매일 11:00 ~ 02:00
*전화번호 : 02-856-3323
혼마구로 35,000원 이 날 방문한 매장은 이마트에서 도보로 4분이면 도착했는데요.
검은색 간판에 조명이 환하게 빛나고 있어서 찾아내기가 쉽더라고요. 가게 앞에는 영업시간이 적혀있었어요.
오전 11시에 오픈해서 새벽 2시에 마감이라니 참고해두시면 편하실거에요. 안으로 들어서면 식사중인 손님들로 인해 홀은 이미 만석이었는데요.
인기가 많은 구로디지털단지역 맛집이라서 맛은 어떨지 궁금하더라고요. 한켠에는 다찌 테이블이 마련되어 있었는데요.
고급스러운 인테리어에 분위기가 좋아서 혼술을 마시기에도 손색이 없겠더라고요. 몇발자국 옮겨보면 개별룸이 준비되어 있었는데요.
4인부터 30인까지 수용이 가능한 구로디지털단지역 맛집이라 클라스가 돋보이더라고요. 직원분의 안내를 받고 방을 하나씩 둘러봤는데요.
청결에 신경을 많이 쓰시는지 전체적으로 깔끔해서 위생적인 부분에서 안심이 되더라고요. 구경을 마친 뒤 자리에 앉아 메뉴를 살펴봤어요.
무한리필 전문점 답게 코스요리부터 단품까지 다양하게 판매중이길래 가성비가 돋보였던 특(39,000원)으로 주문해봤어요. 한 15분쯤 지나고나면 상차림이 차려졌는데요.
참치와 잘 어울리는 정갈한 구성으로 내어주셔서 구로디지털단지역 맛집을 찾아오길 잘했다는 생각이 들더라고요. 먼저 공복을 달래줄 흑임자죽부터 먹어봤어요.
국내산 찹쌀이 들어있어 부드러운 밥알에고소한 향내음이 매력적이었어요. 이어 미소된장국도 한모금 마셔봤는데요.
장시간 우려낸 국물이라 진한 풍미가 베여있어서 인상깊더라고요. 다음은 숙성된 절임류를 맛 볼 차례였어요.
국내에서 보기 힘든 일본식 반찬이라 대접받는 기분이 들어서 좋았어요. 냉큼 참치내장 젓갈부터 맛보았는데요.
신선한 참치를 엄선해서 만들었는지 비린내 없이 감칠맛이 뛰어나서 자꾸만 손이 가더라고요. 연이어 붉은색 시소노미구라게도 한입했어요.
자연산 해파리의 꼬들거리는 식감에 시소 특유의 풍미까지 더해져서 별미였어요. 그런가하면 타코와사비도 나오길래 한젓가락 집어봤는데요.
톡 쏘는 감칠맛은 물론이고 육질도 쫄깃해서 흠 잡을데가 없더라고요. 틈틈히 마늘절임도 한알씩 먹어보았는데요.
국산 육쪽마늘이라 매운맛과 단맛의 적절한 조화가 기억에 오랫동안 남더라고요. 개인적으로 좋아하는 간장새우도 있길래 한입 베어물었어요.
서해에서 공수한 싱싱한 새우로만 담궈서 탱글탱글한 식감이 포인트였어요. 다음으로 참치초밥들도 살펴봤는데요.
고급 스시집보다 횟감도 두툼한데다 초대리의 간도 딱 맞아서 실력을 인정해주고 싶더라고요. 어느정도 먹다보면 구로디지털단지역 맛집의 특참치가 테이블에 등장했어요.
오도로, 맥가도로, 꼬리, 배꼽살, 적신등 가격에 비해 양이 많아서 가성비가 돋보였어요. 우선은 기본 부위인 적신부터 한입했는데요.
풍부한 살코기에 지방이 적게 함유되서 말랑말랑한 질감이 인상적이더라고요. 뒤이어 참다랑어의 꼬리살도 음미했어요.
탄력있는 살점에 힘줄이 콕 박혀있어서 쫄깃한 육질이 일품이었어요. 게다가 새하얀 배꼽살은 입안에서 살살 녹아내렸는데요.
지방의 함유량이 높아서 미식가인 어머니도 맛있다며 칭찬을 아끼지 않으시더라고요. 이외에 가마도로도 푸짐하게 얹어져있었는데,
등급이 좋은 태평양산 참치라서 골고루 분포된 마블링에 엄지가 절로 세워졌어요. 그냥 먹어도 맛있었지만 반찬을 곁들여주면 별미였는데요.
다채로운 풍미와 식감들이 한데 어우러져서 미소짓게 만들더라고요. 슬슬 후반부로 넘어와서 은행구이에 손을 댔어요.
뜨거운 철판에 노릇노릇하게 구워진 마늘과 함께 담겨있어서 골라먹는 재미가 쏠쏠했어요. 옆쪽에는 갓 조리된 참치조림이 놓여있었는데요.
오랜시간 졸여냈는지 매콤한 양념이 깊숙히 스며있어서 완전 밥도둑이더라고요. 다음으로는 메로구이가 테이블로 나왔는데,
식재료 관리가 잘 되어있어 잡냄새도 없는데다 부드럽고 촉촉한 생선살이 인상깊었어요. 이건 홍합이랑 파프리카가 섞인 요리였는데요.
무르기 쉬운 재료들인데도 아삭한 식감이 고스란히 살아있어서 만족스럽더라고요. 이번에는 새우튀김이 나왔어요.
기름을 자주 교체하시는지 튀김옷이 깨끗해서 마음에 쏙 들었어요. 구로디지털단지역 맛집에서 마무리는 토마토 마리네이드로 장식했는데요.
해파리부터 채소에 버섯까지 아낌없이 들어있어서 후한 인심이 느껴지더라고요. 뒤이어 입가심용으로 냉모밀까지 먹었어요.
순도 99%의 메밀면이 들어있어서 찰지게 달라붙는 면발이 압권이었어요.
그렇게 참치의 퀄리티와 구성까지 모든것이 만족스러웠던 구로디지털단지역 맛집이라 앞으로도 간간히 들려 볼 예정이에요. 2. 부원면옥
*주소 : 서울 중구 남대문시장4길 41-6
*영업시간 : 11:00 ~ 20:00
*전화번호 : 02-753-7728
평양냉면 8,500원 회현역 맞은편에 위치한 30년 전통의 평양냉면집 인부원면옥은 생방송오늘저녁 1057회에 출연했던 곳인데요. 천연재료로 우린 맑은 육수에 수작업으로 만든 수타면을 넣어서 요리의 완성도가 높더라고요.
3. 검단양만
*주소 : 서울 송파구 백제고분로 7길 40-17
*영업시간 : 10:50 ~ 23:00
*전화번호 : 02-3431-9555
장어구이 39,000원 잠실새내역 근처에 장어 전문점인 검단양만은 생생정보통 16회차에 방영되었던 곳이었어요. 고창에서 직송해온 토종 장어만을 고집해서 잡냄새가 적고 살이 부드럽다는게 장점이에요.
4. 미림산장
*주소 : 서울 강북구 삼양로 181길 253
*영업시간 : 10:30 ~ 22:30
*전화번호 : 02-993-3330
토종닭백숙 65,000원 용덕사에서 차량으로 5분이면 도착하는 유명한 한식집인 미림산장은 VJ특공대 722회차에 소개되었던 가게인데요. 직접 기른 토종닭에 20가지 한약재를 넣고 끓인 닭백숙은 국물이 진국이더라고요.
5. 독립카츠
*주소 : 서울 마포구 연남로 19
*영업시간 : 11:30 ~ 21:30
*전화번호 : 02-333-1574
모듬돈카츠 14,000원 경의선 숲길공원 바로 앞에 자리한 일본식 돈까스집인 독립카츠는 생방송투데이 2470회차에서 극찬을 받았어요. 한돈 등심으로 튀겨낸 돈까스를 선보이는데, 연한 육질과 바삭한 튀김옷이 특징이에요.
이 포스팅은 소정의 원고료를 지원받아 작성하였습니다."
1,옹골찼던 구로디지털단지역 맛집 리스트,꽁주빵주,2021. 11. 14. 8:00," 며칠 전 친구들과 저녁 약속이 있어서 지인이 알려준 구로디지털단지역 맛집을 찾아갔어요. 선도 좋은 해산물 요리를 푸짐하게 즐겼던 곳이라 소개해 드리려고 해요! 이 날 방문한 품격사시미는 깔깔거리 내에 자리를 잡고 있어요. 커다란 건물에 새하얀 간판이 밝게 들어와 초행길임에도 쉽게 찾았네요. 실내로 입장해보니 은은한 조명이 비치는 홀이 우리를 맞이해주었는데요. 이른 시간인데도 곳곳에 식사하시는 손님들이 많더라고요. 안내받은 자리에 착석 후 메뉴판을 스캔해봤어요. 단품도 있었지만, 가성비가 훌륭한 세트 구성이 있어서 바로 주문을 했어요. 얼마 남짓 지나자 밑반찬과 함께 메인요리가 셋팅되었어요. 가짓수도 많고 플레이팅도 예쁘게 되어 있어서 먹음직스러워 보이더라고요! 우선 구로디지털단지역 맛집 국물떡볶이를 먹어보기로 했어요. 떡과 어묵이 한가득 들어 있어서 다같이 나눠 먹기 괜찮아요. 간이 알맞아서 식전에 애피타이저로 제격이었어요. 탱글한 밀떡은 취향을 제대로 저격해 주어 순식간에 그릇을 비워내게 했네요. 뒤이어 맛본 것은 연어샐러드에요. 굵기도 두툼해서 하나만 먹어도 입안 가득 차는 식감이 좋아 같이 간 일행들도 만족한 눈치였어죠. 윤기가 흐르는 모습은 시선을 강탈할 수밖에 없어요. 느끼하지 않고 담백한 맛이 훌륭해 단품으로 추가하고 싶어질 정도였네요. 샐러드로 먹을 수 있도록 채소들도 신선한 걸 준비해주셨는데요. 옆에 있던 타르타르소스에 듬뿍 찍어주면 달달함이 가미되어 풍미를 더욱 높여주었어요. 구로디지털단지역 맛집의 산낙지는 주문 즉시 잡으셨는지 신선해 보였어요. 서빙이 되고 한동안 꿈틀거리는 힘이 대단하더라고요. 얼른 숟가락을 이용해 한 술 떠 맛봤는데요. 한입 가득 넣어도 쫀득거리는 텍스처가 좋아 만족스러웠어요! 이번엔 튀김을 살펴보기 시작했어요. 바로 튀겨 나와서 그런지 바삭함을 유지하고 있었어요. 살짝 간장에 담가주면 감칠맛이 더해졌어요. 겉바속촉이 뭔지 알려주기라도 하듯 한입 베어 물면 바스락거리는 소리가 울려 퍼지더라고요. 틈틈이 콘버터를 곁들이기도 했어요. 버터의 고소함과 톡톡 터지는 알맹이의 식감이 좋아 두 번이나 더 리필을 받을 정도예요. 기다렸던 메인회는 종류가 다섯가지 이상이 나왔어요. 가리비는 물론이고 각종 해산물까지 신선하게 즐길 수 있다는 점이 구로디지털단지역 맛집의 매리트였죠. 우선 가리비부터 집어 들어 봤어요. 수율이 높아서 그런지 큼직한 알맹이가 씹혀 취향을 제대로 저격해주더라고요. 두툼하게 썰려있는 회는 가지런히 올려두셨는데요. 여러 가지 종류가 들어 있어서 번갈아 먹기 좋아요. 아무 양념을 곁들이지 않고 곧장 입가에 가져가 보았어요. 담백한 맛은 물론이고 특유의 비린내가 일절 나지 않아 예민한 제 입에도 괜찮았네요. 바다의 맛이 가득 느껴졌던 구로디지털단지역 맛집 멍게도 별미에요! 처음에는 쌉싸름하다가도 씹을수록 달콤했죠. 살짝의 와사비만으로도 풍미를 더 할 수 있었어요. 코끝을 자극하는 알싸함이 입안을 정돈해주어 물리지 않고 폭풍흡입 할 수 있었네요. 틈틈이 초장을 함께해주는 것도 잊지 않았는데요. 새콤달콤함이 회의 본연의 맛을 유지하며 풍미를 진하게 만들어 주었어요. 중간에는 구로디지털단지역 맛집에서 소주와 맥주를 추가하여 마셨어요. 시원한 목 넘김과 요리들의 조화가 기가 막히더라고요. 관자는 큼지막하여 먹음직스러웠는데요. 몇 번 씹지 않아도 부드러운 목 넘김이 예술이었어요. 끝으로 장식해준 매운탕의 얼큰함은 해장을 해주는 것 같았어요. 생선은 물론이고 각종 채소까지 듬뿍 들어 있어서 육수의 진함이 남달랐네요. 건더기에 있는 살코기를 발라 먹는 재미도 있었어요. 국물이 스며들어 있어서 그런지 매콤한게 제 입맛에 맞았어요. 이렇게 구로디지털단지역 맛집에서 친구들과 흡족스로운 식사를 하였어요. 해산물이 모두 신선하고 맛이 좋아 다음에는 부모님과 재방문할 예정이랍니다!  저녁에는 대림사거리 인근에 위치한 곰탕집에 갔어요. 내부가 넓었고 고등색으로 인테리어를 해서 고급스러웠 보였는데요. 꼬리탕은 국물이 진하고 고기가 푸짐하게 들어가 있어서 만족스러웠어요. 점심에는 가족들과 가리봉시장 근천에 있는 중식집에 다녀왔어요. 매장이 오래되었는지 옛스러운 느낌이 좋았던 곳인데요. 군만두는 바삭한 식감이 일품이었고 담백한 맛이 훌륭해 맛있게 먹었답니다. 식후에는 이마트 구로점에서 도보로 3분거리인 케이크 전문점에 방문했어요. 실내는 크지는 않지만 아기자기한 장식품들로 꾸며 놓아 분위기 좋았는데요. 딸기주스는 달콤한 맛이 으뜸이라 디저트의 조화가 좋아 남김없이 먹었어요. 다음날에는 구로G밸리 비즈플라자 건물안에 위치한 전골집에 갔어요. 매장이 크고 깔끔하게 인테리어를 하셔서 세련되보였어요. 김치찌개는 해남 배추로 만든 묵은지로만 사용해서 그런지 국물의 깊은 맛이 일품이었답니다.
<!-- 본 포스팅은 소정의 원고료를 받고 작성하였습니다 -->"
2,빈틈없는 구로디지털단지역 맛집 모음,"따짱맘킴쏘
(kimmso1)",17시간 전,"지난 주말 친구들과 구로에서 만났다가 근방에서 유명하다는 구로디지털단지역 맛집에 방문했어요. 
신선한 초밥, 사시미, 우동, 모밀까지 다채롭게 즐겼는데요 저렴한 가격에 감동했던 곳이라 소개해 볼게요. 
1. 상무초밥
모듬스시 11,000원/오늘의스시 15,000원 주소 : 서울특별시 관악구 시흥대로 568 1층
영업시간 : 매일 11:00 - 23:00
전화번호 : 02-859-3339 이날 찾아갔던 상무초밥은 구로 이마트점에서 차로 5분이면 도착할 수 있었어요. 
큰 대로변 1층 건물에 흰색 간판이 멀리서도 눈에 띄어 차 안에서도 쉽게 찾을 수 있었어요.  건물 외벽에는 영업시간에 대한 안내 팻말이 붙어있었는데요. 
매일 오전 11시부터 오후 11시까지 연중무휴라고 하니 방문 시 참고해 보세요.  구로디지털단지역 맛집 앞에는 전용 주차장도 마련되어 있었어요. 
덕분에 차를 가지고 간 저희도 주차 걱정 없이 수월하게 파킹 할 수 있었어요.  현관문을 열고 들어가면 대기석이 쭉 놓여 있었는데요. 
푹신한 쿠션 덕에 대기시간에도 편하게 기다릴 수 있어 문제없어 보였어요.  그런가 하면 큐얼 체크 기계도 시선을 사로잡았는데요. 
입장하는 손님 모두 큐얼 인증을 마친 뒤에 입장할 수 있으니 요즘 같은 시국에도 안심할 수 있었어요.  더 안쪽으로 발걸음을 옮기니 탁 트인 내부 홀이 펼쳐졌어요. 
층고가 높아 전혀 답답하지 않았고 테이블은 앞, 뒤로 넓게 떨어져 있어 쾌적한 식사가 가능해 보였어요.  구로디지털단지역 맛집의 주방은 오픈형으로 개방되어 있었는데요. 
재료 손질 중인 셰프님은 앞치마, 위생모, 마스크, 장갑까지 철저하게 착용하고 계셔서 위생적으로도 칭찬할 만했어요.  게다가 유아용 의자도 비치되어 있었는데요. 
영유아를 동반한 가족단위 손님을 생각한 사장님의 배려심에 감동적이었어요.  한쪽에는 음료 냉장고도 확인해 볼 수 있었어요. 
탄산음료, 주스뿐 아니라 매장에서 직접 담근 식혜까지 부담스럽지 않은 가격에 판매하고 있어 만족스러웠어요.  직원분의 안내에 자리를 잡고 앉아봤어요. 
먼지 하나 없이 말끔하게 닦여있는 테이블이라 까탈스러운 친구도 흡족한 미소를 지었어요.  사이드에는 3종류의 기본 곁들임찬이 통에 담겨 있었는데요. 
락교, 단무지, 초생강까지 전부 일식 요리와 잘 어울리는 것들이라 케미가 기대됐어요.  본격적인 식사를 위해 구로디지털단지역 맛집의 메뉴판을 쭉 읽어봤어요. 
다양한 종류의 일식요리가 적혀있었는데 가장 베스트라는 모듬회, 오늘의 초밥, 오마카세를 추천받아 주문을 넣었어요.  잠시 후 저희가 주문한 음식들이 테이블 위로 한상 가득 차려졌는데요. 
하나같이 신선한 비주얼은 물론 플레이팅도 화려해서 인증샷으로 한 컷 남겨봤어요.  제일 먼저 백김치를 맛봤는데요. 
양념을 흐르는 물에 씻어 참기름으로 볶아낸 별미스러움에 자꾸만 손이 갔어요.  그런가 하면 마늘장아찌에도 손을 뻗어봤어요. 
간장에 푹 절여진 탓에 매운맛이 덜하고 감칠맛이 진해 식욕을 끌여올려줬어요.  다음은 구로디지털단지역 맛집의 냉모밀도 선점해 봤는데요. 
쫄깃한 면발을 냉육수에 푹 담가먹는 재미도 쏠쏠해 지루할 틈이 없었어요.  이번에는 참치초밥을 공략해 봤어요. 
품질이 좋은 생선만 사용해 살이 통통했고 살점의 단맛이 고스란히 전해졌어요.  그리고 연어초밥도 입에 쏙 넣어봤어요. 
몇 번 씹지도 않았는데 사르를 녹아버리는 질감에 두 눈이 번쩍 뜨였어요.  다음은 소고기불초밥을 음미해 봤어요. 
송골송골 육즙은 무론 표면을 토치로 구워 은은하게 올라오는 불향까지 미식가인 친구도 인정하는 눈치였어요.  이윽고 스시오마카세도 모습을 드러냈는데요. 
차가운 돌판에 담겨있는 다채로운 종류의 초밥은 오랜 시간 신선함을 유지해 주니 더할 나위 없었어요.  구로디지털단지역 맛집의 묵은지 초밥을 냠 해봤는데요. 
단촛물이 스며든 찰기 가득한 밥알에 아삭하면서도 새큼한 김치의 캐미가 좋아 자꾸만 손이 갔어요.  뿐만 아니라 초새우도 입가에 가져가 봤어요. 
톡톡 터지는 새우살밥이 입에 착착 감겨 순식간에 한 접시를 클리어했어요.  물론 간장새우도 즐겨봤는데요. 
간장에 숙성됐음에도 새우의 단미가 뒤처지질 않아 감탄사가 터져 나왔어요.  이윽고 우동도 맛보기로 했는데요. 
가쓰오부시 육수가 우동면에 잘 스며들어 이것만으로도 일당백을 해냈어요.  마지막은 수정과로 대미를 장식해 봤어요. 
쌉싸름하면서도 달콤한 수정과로 입가심은 물론 속까지 시원하게 풀어줄 수 있어 완벽했던 구로디지털단지역 맛집이라 다음 모임도 여기서 하자며 약속했답니다! 2. 고마워케이크
말차라떼 6,000원 주소 : 서울 구로구 디지털로 300
영업시간 : 평일 10:30 - 22:30
전화번호 : 0507-1412-3906
식후에는 이마트 구로점에서 도보로 3분 거리인 케이크 전문점에 방문했어요. 
가게 내부가 크지는 않지만 아기자기한 장식품들로 꾸며 놓아 분위기 좋았는데요. 
딸기주스는 달콤한 맛이 으뜸이라 디저트의 조화가 좋아 남김없이 먹었어요. 
3. 원래순교자관
완탕 5,000원 주소 : 서울 구로구 디지털로19길 12
영업시간 : 매일 11:00 - 22:00
전화번호 : 02-855-8488
저녁에는 가족들과 가리봉시장 근처에 있는 중식집에 다녀왔어요. 
매장이 오래됐는지 예스러운 느낌이 향토적으로 느껴져 편안하고 아늑했어요. 
군만두는 바삭한 식감이 일품이었고 담백한 맛이 훌륭해 맛있게 흡입했어요. 
4. 데이즈앤데이즈
바질 크로칸트 4,500원 주소 : 서울 관악구 시흥대로 578 광안빌딩 2층
운영시간 : 매일 09:00 - 00:00
전화번호 : 0507-1426-0093
구디역 사거리 방면에 위치한 베이커리집으로 생방송투데이 2347회에도 소개됐던 매장이에요. 
당일 생산 및 판매 원칙의 빵들로 흠뻑 취할 수 있었어요. 
그중에서도 바질과 생크림이 듬뿍 들어간 크로칸트가 최고로 꼽힌다고 했는데 추가로 직접 로스팅 하는 커피와 건강음료도 인기 만점이었어요. 
5. 등나무집
꼬리찜(中) 70,000원 주소 : 서울 동작구 대림로 52
운영시간 : 매일 11:00 - 22:00
전화번호 : 02-843-8989
마지막으로 대림사거리 근방에 자리한 등나무집은 유명 연예인이 단골로 갈 정도로 이름난 곳이에요. 
메뉴 중에 시그니처로 불리는 꼬리찜은 쫀득한 육질이 찬탄을 자아냈어요. 
최고의 식재료를 향한 사장님의 열망을 온전히 체험할 수 있는 곳이니 꼭 들러보시길 바랄게요. "
